

 Parallel Execution: Process Information
 ==============================================================================
 Rank   Node Name                              NodeID   MyNodeRank  NodeMaster
    0   dhcp-187-164.clients.vu.nl                0          0          0
    1   dhcp-187-164.clients.vu.nl                0          1         -1
    2   dhcp-187-164.clients.vu.nl                0          2         -1
    3   dhcp-187-164.clients.vu.nl                0          3         -1
    4   dhcp-187-164.clients.vu.nl                0          4         -1
    5   dhcp-187-164.clients.vu.nl                0          5         -1
    6   dhcp-187-164.clients.vu.nl                0          6         -1
    7   dhcp-187-164.clients.vu.nl                0          7         -1
    8   dhcp-187-164.clients.vu.nl                0          8         -1
    9   dhcp-187-164.clients.vu.nl                0          9         -1
 ==============================================================================


May use up to 15625MB of RAM as shared memory on node 0

 *******************************************************************************
 *                                                                             *
 *  --------------------------------                                           *
 *   Amsterdam Modeling Suite (AMS)              2022.103                      *
 *  --------------------------------                                           *
 *                                               r104886 2022-06-17            *
 *                                                                             *
 *                                                                             *
 *                              =================                              *
 *                              |               |                              *
 *                              |     A M S     |                              *
 *                              |               |                              *
 *                              =================                              *
 *                                                                             *
 *                                                                             *
 *   Online information and documentation:  https://www.scm.com/support/       *
 *   E-mail:  support@scm.com   info@scm.com                                   *
 *                                                                             *
 *   Scientific publications using AMS results must be properly referenced     *
 *   See the User Manuals (or the web site) for recommended citations          *
 *   The terms and conditions of the End User License Agreement apply to       *
 *   the use of AMS, https://www.scm.com/license-terms/                        *
 *                                                                             *
 **********************  x86_64_darwin_intel / openmpi  ************************
 
 Licensed to: Prof Visscher, Prof Bickelhaupt, Prof Fonseca Guerra / Vrije Universiteit, Theoretische Chemie / Amsterdam / NETHERLANDS 2022-12-13 09:59:29
 SCM User ID: u21794
  
 AMS 2022.103  RunTime: Sep26-2023 14:10:51  ShM Nodes: 1  Procs: 10

 AMS jobname: ams
 AMS jobid  : 758381213

 Start   directory: /Users/yumanhordijk/PhD/pi_rotation/methyl/tmp.yumanhordijk.13776.0.noindex/
 Results directory: /Users/yumanhordijk/PhD/pi_rotation/methyl/sp.results/
 Scratch directory: /tmp/amstmp_ams_kid0.758381213/


 Communication costs MPI_COMM_WORLD:      9.351 usec per message,   0.1331 usec per 8-byte item
 Communication costs for intra-node:      8.268 usec per message,   0.1697 usec per 8-byte item

 RNG seed: -1410782514 -54602016 -1263989647 -584782434 1222775472 -217086751 188338766 151130815



                     *************************************************************************
                     *  ADF 2022.103  RunTime: Sep26-2023 14:10:54  ShM Nodes: 1  Procs: 10  *
                     *************************************************************************
  
       ****************************
       * SINGLE POINT CALCULATION *
       ****************************
 
--------
Geometry
--------
Formula: CH3
Atoms
  Index Symbol   x (angstrom)   y (angstrom)   z (angstrom)
      1      C     0.00000000     0.00000000     0.00000000
      2      H     0.53644704     0.92915353     0.00000000
      3      H     0.53644704    -0.92915353     0.00000000
      4      H    -1.07289408     0.00000000     0.00000000
 
Total System Charge             0.00000
Bonding info available!
 
 
----------------
ADF Engine Input
----------------
 
 Basis
 Type TZP
 Core None
 End
 SpinPolarization 1
 Symmetry NOSYM
 Unrestricted Yes
 

 Title: *** (NO TITLE) ***

 *** adf ***



 ===========================
 A T T A C H E D   F I L E S
 ===========================
  



 ===============================
 M O D E L   P A R A M E T E R S
 ===============================
  
 DENSITY FUNCTIONAL POTENTIAL (scf)
    LDA:                               VWN                                      
    Gradient Corrections:              ---                                      

 SPIN  (restricted / unrestr.)
    Molecule:                          UNrestricted                            == Not Default ==
    Fragments:                         Restricted                               

 OTHER ASPECTS
    Relativistic Corrections:          scalar (ZORA,MAPA)                       

    Nuclear Charge Density Model:      Point Charge Nuclei                      
    Core Treatment:                    Frozen Orbital(s)                        

    Hyperfine or Zeeman Interaction:   ---                                      


 Fragment File(s)
 ----------------
 C:
         file : /Users/yumanhordijk/PhD/pi_rotation/methyl/sp.results/t21.3CFA1EC3.C
         jobid: 0
         title: Carbon (TZP)
 H:
         file : /Users/yumanhordijk/PhD/pi_rotation/methyl/sp.results/t21.28D43D53.H
         jobid: 0
         title: Hydrogen (TZP)



 ===============
 G E O M E T R Y  ***  Planar Molecule  ***
 ===============
  

 ATOMS
 =====                            X Y Z                    CHARGE
                                (Angstrom)             Nucl     +Core       At.Mass
                       --------------------------    ----------------       -------
    1  C               0.0000    0.0000    0.0000      6.00      6.00       12.0000
    2  H               0.5364    0.9292    0.0000      1.00      1.00        1.0078
    3  H               0.5364   -0.9292    0.0000      1.00      1.00        1.0078
    4  H              -1.0729    0.0000    0.0000      1.00      1.00        1.0078


 FRAGMENTS
 =========                                     Atoms in this Fragment     Cart. coord.s (Angstrom)
                                               -------------------------------------------------------
    1  C                                                 1  C            0.0000    0.0000    0.0000
    2  H                                                 2  H            0.5364    0.9292    0.0000
    3  H                                                 3  H            0.5364   -0.9292    0.0000
    4  H                                                 4  H           -1.0729    0.0000    0.0000


 Interatomic Distance Matrix (Angstrom)
 --------------------------------------

   1)     0.000
   2)     1.073   0.000
   3)     1.073   1.858   0.000
   4)     1.073   1.858   1.858   0.000

 Min. Distance =    1.0729
 Max. Distance =    1.8583



 =====================================
 S Y M M E T R Y ,   E L E C T R O N S
 =====================================
  
 Symmetry: NOSYM

 Irreducible Representations, including subspecies
 -------------------------------------------------
 A


 Configuration of Valence Electrons
 ==================================
 ( determined in the SCF procedure )

 Total:   5 (Spin-A)  + 4 (Spin-B)

 Net Charge: 0 (Nuclei minus Electrons)
 Spin polar: 1 (Spin_A minus Spin_B electrons)

 Aufbau principle for MO occupations will be applied through SCF cycle no.     150
 Thereafter, the program will assign electrons to MOs that are spatially
 similar to the occupied MOs in a "reference" cycle ("KeepOrbitals").
 The reference cycle is always the PREVIOUS cycle: it will evolve with
 the SCF procedure.
1
 ***************************************************************************************************



                                      ****************************************
                                      *  B U I L D : (Fragments, Functions)  *
                                      ****************************************
  



 =======
 S F O s  ***  (Symmetrized Fragment Orbitals)  ***
 =======
  
 SFOs are linear combinations of (valence) Fragment Orbitals (FOs), such that the SFOs transform as the
 irreducible representations of the (molecular) symmetry group. Each SFO is therefore characterized by
 an irrep of the molecule and by a few (or only one) generating FOs.
 The SFOs constitute a symmetry-adapted basis for the Fock matrix. The MO eigenvector coefficients in
 this basis provide a direct interpretation of the MOs in terms of Frontier Orbital Theory.

 The SFOs are combined with auxiliary Core Functions (CFs) to ensure orthogonalization on the (frozen)
 Core Orbitals (COs). The Core-orthogonalized SFOs (CSFOs) constitute the true Fock basis.

 The FOs, and hence also the (C)SFOs are combinations of the elementary basis functions (BAS). The basis
 functions that participate in the description of the SFOs depend on the irrep. The indices of the
 involved functions are printed below for each irrep.
 (The complete list of primitive basis functions is printed in another section)

 Total nr. of (C)SFOs (summation over all irreps) :    37

 NOTE: a (C)SFO that is defined as a combination of more than one FO is usually NOT normalized.



                                       === A ===
 Nr. of SFOs :   37
 Cartesian basis functions that participate in this irrep (total number =    38) :
      1     2     3     4     5     6     9    12     7    10
     13     8    11    14    15    16    17    18    19    20
     21    22    23    24    25    26    27    28    29    30
     31    32    33    34    35    36    37    38

    SFO  (index         Fragment          Generating    Expansion in Fragment Orbitals
  indx  incl.CFs)   Occup   Orb.Energy   FragmentType  Coeff.   Orbital     on Fragment
 --------------------------------------------------------------------------------------
     1       1      2.000      -9.952 au  C             1.00      1 S               1
                        (    -270.814 eV)
     2       2      2.000      -0.502 au  C             1.00      2 S               1
                        (     -13.671 eV)
     3       3       --         0.372 au  C             1.00      3 S               1
                        (      10.122 eV)
     4       4       --         5.428 au  C             1.00      4 S               1
                        (     147.707 eV)
     5       5       --        50.139 au  C             1.00      5 S               1
                        (    1364.364 eV)
     6       6      0.667      -0.200 au  C             1.00      1 P:x             1
                        (      -5.438 eV)
     7       7       --         0.169 au  C             1.00      2 P:x             1
                        (       4.585 eV)
     8       8       --         2.007 au  C             1.00      3 P:x             1
                        (      54.615 eV)
     9       9      0.667      -0.200 au  C             1.00      1 P:y             1
                        (      -5.438 eV)
    10      10       --         0.169 au  C             1.00      2 P:y             1
                        (       4.585 eV)
    11      11       --         2.007 au  C             1.00      3 P:y             1
                        (      54.615 eV)
    12      12      0.667      -0.200 au  C             1.00      1 P:z             1
                        (      -5.438 eV)
    13      13       --         0.169 au  C             1.00      2 P:z             1
                        (       4.585 eV)
    14      14       --         2.007 au  C             1.00      3 P:z             1
                        (      54.615 eV)
    15      15       --         1.235 au  C             1.00      1 D:z2            1
                        (      33.619 eV)
    16      16       --         1.235 au  C             1.00      1 D:x2-y2         1
                        (      33.619 eV)
    17      17       --         1.235 au  C             1.00      1 D:xy            1
                        (      33.619 eV)
    18      18       --         1.235 au  C             1.00      1 D:xz            1
                        (      33.619 eV)
    19      19       --         1.235 au  C             1.00      1 D:yz            1
                        (      33.619 eV)
    20      20      1.000      -0.233 au  H             1.00      1 S               2
                        (      -6.353 eV)
    21      21       --         0.095 au  H             1.00      2 S               2
                        (       2.572 eV)
    22      22       --         1.547 au  H             1.00      3 S               2
                        (      42.104 eV)
    23      23       --         0.403 au  H             1.00      1 P:x             2
                        (      10.966 eV)
    24      24       --         0.403 au  H             1.00      1 P:y             2
                        (      10.966 eV)
    25      25       --         0.403 au  H             1.00      1 P:z             2
                        (      10.966 eV)
    26      26      1.000      -0.233 au  H             1.00      1 S               3
                        (      -6.353 eV)
    27      27       --         0.095 au  H             1.00      2 S               3
                        (       2.572 eV)
    28      28       --         1.547 au  H             1.00      3 S               3
                        (      42.104 eV)
    29      29       --         0.403 au  H             1.00      1 P:x             3
                        (      10.966 eV)
    30      30       --         0.403 au  H             1.00      1 P:y             3
                        (      10.966 eV)
    31      31       --         0.403 au  H             1.00      1 P:z             3
                        (      10.966 eV)
    32      32      1.000      -0.233 au  H             1.00      1 S               4
                        (      -6.353 eV)
    33      33       --         0.095 au  H             1.00      2 S               4
                        (       2.572 eV)
    34      34       --         1.547 au  H             1.00      3 S               4
                        (      42.104 eV)
    35      35       --         0.403 au  H             1.00      1 P:x             4
                        (      10.966 eV)
    36      36       --         0.403 au  H             1.00      1 P:y             4
                        (      10.966 eV)
    37      37       --         0.403 au  H             1.00      1 P:z             4
                        (      10.966 eV)



 ================================
 (Slater-type)  F U N C T I O N S  ***  (Basis and Fit)  ***
 ================================
  

 Atom Type    1  (C)
 ==============

 Valence Basis Sets:   9
 -----------------------
   1 S    7.680000
   1 S    5.000000
   2 S    1.280000
   2 S    2.100000
   2 S    4.600000
   2 P    0.820000
   2 P    1.480000
   2 P    2.940000
   3 D    2.200000

 Atom Type    2  (H)
 ==============

 Valence Basis Sets:   4
 -----------------------
   1 S    0.690000
   1 S    0.920000
   1 S    1.580000
   2 P    1.250000


 BAS: List of all Elementary Cartesian Basis Functions
 =====================================================

 The numbering in the list below (to the right of the function characteristics) is referred
 to in print-outs of MO eigenvectors and Mulliken populations in the BAS representation
 (as contrasted to the SFO representation).

 Notes:
 1. The functions are characterized by a polynomial prefactor (powers of x,y,z and r) and
    an exponential decay factor alpha.
 2. Since the basis sets are specific for an atom TYPE, the individual functions occur on
    all atoms of that type.
 3. The word 'Core' in the left margin signals that it is a Core Function (CF) : not a
    degree of freedom in the valence set, but only used to ensure orthogonalization of
    the other valence basis functions on the frozen Core Orbitals.


 (power of) X  Y  Z  R     Alpha  on Atom
            ==========     =====     ==========

 C                                    1
                                  ---------------------------------------------------------------------------
            0  0  0  0     7.680      1
            0  0  0  0     5.000      2
            0  0  0  1     1.280      3
            0  0  0  1     2.100      4
            0  0  0  1     4.600      5
            1  0  0  0     0.820      6
            0  1  0  0     0.820      7
            0  0  1  0     0.820      8
            1  0  0  0     1.480      9
            0  1  0  0     1.480     10
            0  0  1  0     1.480     11
            1  0  0  0     2.940     12
            0  1  0  0     2.940     13
            0  0  1  0     2.940     14
            2  0  0  0     2.200     15
            1  1  0  0     2.200     16
            1  0  1  0     2.200     17
            0  2  0  0     2.200     18
            0  1  1  0     2.200     19
            0  0  2  0     2.200     20

 H                                    2    3    4
                                  ---------------------------------------------------------------------------
            0  0  0  0     0.690     21   27   33
            0  0  0  0     0.920     22   28   34
            0  0  0  0     1.580     23   29   35
            1  0  0  0     1.250     24   30   36
            0  1  0  0     1.250     25   31   37
            0  0  1  0     1.250     26   32   38

 Total number of charge fitting functions (nprimf)       234
 Total number of Cartesian basis functions (naos)         38
 Total number of Cartesian core functions  (ncos)          0

1
 ***************************************************************************************************



                                              ***********************
                                              *  T E C H N I C A L  *
                                              ***********************
  



 =============================================================
 P A R A L L E L I Z A T I O N  and  V E C T O R I Z A T I O N
 =============================================================
  
 Nr of parallel processes:                               10
 Maximum vector length in NumInt loops:                 128



 =====================
 S C F   U P D A T E S
 =====================
  
 Max. nr. of cycles:                               300
 Convergence criterion:                              0.0000010000
   secondary criterion:                              0.0010000000

 Mix parameter (when DIIS does not apply):           0.2000000000
 Mixed ADIIS+SDIIS will be used                  
    Max number of expansion vectors:                10
    Pure ADIIS when Max([F,P]) is above              0.1000000000
    Pure SDIIS when Max([F,P]) is below              0.0010000000
 Automatic ElectronSmearing (in case of problematic SCF convergence) disabled



 =================
 P R E C I S I O N  ***  (General: NumInt, NeglectFunctionTails, ...)  ***
 =================
  

 NumInt:           Target precision:                 4.0000000000
 -------           Initial precision:                4.0000000000
                   Min. precision (optimization):    4.0000000000

 Neglect Functions:          Basis functions:        0.1000000000E-05
 ------------------          Fit functions:          0.1000000000E-05



 ===========================
 L I N E A R   S C A L I N G
 ===========================
  

 Cut-off radii density fit:                        0.1000000000E-07
 Overlap cut-off criterion AO matrix elements:     0.1000000000E-05
 Cut-offs for Coulomb potential and fitted density:0.1000000000E-07
 Cut-off criterion for Coulomb multipole terms:    0.1000000000E-07
 Progressive Convergence parameter:                 0.000000000    
1
 ***************************************************************************************************



                                            ***************************
                                            *  C O M P U T A T I O N  *
                                            ***************************
  

 Number of elements of the density matrix on this node (used, total):       210       741



 ===========================================
 Numerical Integration : Fuzzy Cells (Becke)
 ===========================================
  
 Becke grid quality: NORMAL         
  
 Lebedev angular grid order:             min:  11 max:  23
 Nr. of radial points:                   min:  46 max:  52

 Total nr. of points:      24436
 Nr. of blocks:              191
 Block length:               128
 Nr. of dummy points:         12


 Test of Precision of the Numerical Integration Grid
 ===================================================

 Integral of the Total Core Density:                   0.00000000000000



 ========================
 Density Fitting (zlmFit)
 ========================
  
 ZlmFit Fit Quality: NORMAL         
  
 Max L-expansion:                        min:   5 max:   6
 Nr. of radial interpolation points:     min:  36 max:  48



 =====
 S C F  ***  ScaSCF  ***
 =====
  
 Initial density matrix is calculated as sum of fragments

 CYCLE    1
 SCF Error: norm([F,P])=      2.059893432713, max([F,P])=      0.490898731190
 ***** SPIN 1 *****
 orbitals (Q,E):
 ---------------
 A :1...15           ( 1.00   -10.0762)  ( 1.00    -0.7861)  ( 1.00    -0.5491)  ( 1.00    -0.5491)
                     ( 1.00    -0.3183)  ( 0.00    -0.0462)  ( 0.00     0.0060)  ( 0.00     0.0060)
                     ( 0.00     0.0783)  ( 0.00     0.0783)  ( 0.00     0.1104)  ( 0.00     0.1377)
                     ( 0.00     0.2783)  ( 0.00     0.2783)  ( 0.00     0.3860)
 ***** SPIN 2 *****
 orbitals (Q,E):
 ---------------
 A :1...14           ( 1.00   -10.0762)  ( 1.00    -0.7861)  ( 1.00    -0.5491)  ( 1.00    -0.5491)
                     ( 0.00    -0.3183)  ( 0.00    -0.0462)  ( 0.00     0.0060)  ( 0.00     0.0060)
                     ( 0.00     0.0783)  ( 0.00     0.0783)  ( 0.00     0.1104)  ( 0.00     0.1377)
                     ( 0.00     0.2783)  ( 0.00     0.2783)
  
 Spin polar: 1 (Spin_A minus Spin_B electrons)

 CYCLE    2
  SDIIS (wt  0.000):  0.1037  0.8963
 A-DIIS (wt  1.000):  0.4966  0.5034
  DIIS coefficients:  0.4966  0.5034
 SCF Error: norm([F,P])=      0.556959455447, max([F,P])=      0.099731730488
 ***** SPIN 1 *****
 orbitals (Q,E):
 ---------------
 A :1...6            ( 1.00    -9.7507)  ( 1.00    -0.6313)  ( 1.00    -0.4025)  ( 1.00    -0.4025)
                     ( 1.00    -0.1864)  ( 0.00    -0.0008)
 ***** SPIN 2 *****
 orbitals (Q,E):
 ---------------
 A :1...5            ( 1.00    -9.7425)  ( 1.00    -0.6162)  ( 1.00    -0.3947)  ( 1.00    -0.3946)
                     ( 0.00    -0.1536)
  
 Spin polar: 1 (Spin_A minus Spin_B electrons)

 CYCLE    3
  SDIIS (wt  0.000):  0.0125  0.1642  0.8233
 A-DIIS (wt  1.000):  0.0000  0.0000  1.0000
  DIIS coefficients:  0.0000  0.0000  1.0000
 SCF Error: norm([F,P])=      0.131321665203, max([F,P])=      0.023133523264
 ***** SPIN 1 *****
 orbitals (Q,E):
 ---------------
 A :1...6            ( 1.00    -9.8693)  ( 1.00    -0.6371)  ( 1.00    -0.3951)  ( 1.00    -0.3951)
                     ( 1.00    -0.2172)  ( 0.00     0.0013)
 ***** SPIN 2 *****
 orbitals (Q,E):
 ---------------
 A :1...5            ( 1.00    -9.8561)  ( 1.00    -0.6068)  ( 1.00    -0.3796)  ( 1.00    -0.3795)
                     ( 0.00    -0.1514)
  
 Spin polar: 1 (Spin_A minus Spin_B electrons)

 CYCLE    4
  SDIIS (wt  0.752): -0.1188  0.3562  0.7626
 A-DIIS (wt  0.248):  0.0000  0.5458  0.4542
  DIIS coefficients: -0.0893  0.4032  0.6862
 SCF Error: norm([F,P])=      0.137672728037, max([F,P])=      0.025538168817
 ***** SPIN 1 *****
 orbitals (Q,E):
 ---------------
 A :1...6            ( 1.00    -9.8036)  ( 1.00    -0.6196)  ( 1.00    -0.3817)  ( 1.00    -0.3817)
                     ( 1.00    -0.1971)  ( 0.00     0.0044)
 ***** SPIN 2 *****
 orbitals (Q,E):
 ---------------
 A :1...5            ( 1.00    -9.7893)  ( 1.00    -0.5894)  ( 1.00    -0.3668)  ( 1.00    -0.3668)
                     ( 0.00    -0.1317)
  
 Spin polar: 1 (Spin_A minus Spin_B electrons)

 CYCLE    5
  SDIIS (wt  0.998):  0.0133 -0.0088 -0.0287  1.0242
 A-DIIS (wt  0.002):  0.0000  0.0000  0.0000  1.0000
  DIIS coefficients:  0.0133 -0.0087 -0.0287  1.0242
 SCF Error: norm([F,P])=      0.004961470606, max([F,P])=      0.001235028888
 ***** SPIN 1 *****
 orbitals (Q,E):
 ---------------
 A :1...6            ( 1.00    -9.8059)  ( 1.00    -0.6217)  ( 1.00    -0.3835)  ( 1.00    -0.3835)
                     ( 1.00    -0.1989)  ( 0.00     0.0039)
 ***** SPIN 2 *****
 orbitals (Q,E):
 ---------------
 A :1...5            ( 1.00    -9.7912)  ( 1.00    -0.5911)  ( 1.00    -0.3686)  ( 1.00    -0.3686)
                     ( 0.00    -0.1328)
  
 Spin polar: 1 (Spin_A minus Spin_B electrons)

 CYCLE    6
  SDIIS (wt  1.000):  0.0017 -0.0138 -0.0274 -0.0571  1.0967
  DIIS coefficients:  0.0017 -0.0138 -0.0274 -0.0571  1.0967
 SCF Error: norm([F,P])=      0.001088163295, max([F,P])=      0.000268436463
 ***** SPIN 1 *****
 orbitals (Q,E):
 ---------------
 A :1...6            ( 1.00    -9.8054)  ( 1.00    -0.6214)  ( 1.00    -0.3832)  ( 1.00    -0.3832)
                     ( 1.00    -0.1987)  ( 0.00     0.0040)
 ***** SPIN 2 *****
 orbitals (Q,E):
 ---------------
 A :1...5            ( 1.00    -9.7907)  ( 1.00    -0.5907)  ( 1.00    -0.3683)  ( 1.00    -0.3683)
                     ( 0.00    -0.1323)
  
 Spin polar: 1 (Spin_A minus Spin_B electrons)

 CYCLE    7
  SDIIS (wt  1.000): -0.0001  0.0007  0.0018 -0.0057 -0.0708  1.0741
  DIIS coefficients: -0.0001  0.0007  0.0018 -0.0057 -0.0708  1.0741
 SCF Error: norm([F,P])=      0.000071211104, max([F,P])=      0.000018215474
 ***** SPIN 1 *****
 orbitals (Q,E):
 ---------------
 A :1...6            ( 1.00    -9.8054)  ( 1.00    -0.6214)  ( 1.00    -0.3832)  ( 1.00    -0.3832)
                     ( 1.00    -0.1987)  ( 0.00     0.0040)
 ***** SPIN 2 *****
 orbitals (Q,E):
 ---------------
 A :1...5            ( 1.00    -9.7907)  ( 1.00    -0.5907)  ( 1.00    -0.3683)  ( 1.00    -0.3683)
                     ( 0.00    -0.1324)
  
 Spin polar: 1 (Spin_A minus Spin_B electrons)

 CYCLE    8
  SDIIS (wt  1.000): -0.0000  0.0001  0.0002 -0.0004 -0.0104  0.0878  0.9227
  DIIS coefficients: -0.0000  0.0001  0.0002 -0.0004 -0.0104  0.0878  0.9227
 SCF Error: norm([F,P])=      0.000003699648, max([F,P])=      0.000000938160
 ***** SPIN 1 *****
 orbitals (Q,E):
 ---------------
 A :1...6            ( 1.00    -9.8054)  ( 1.00    -0.6214)  ( 1.00    -0.3832)  ( 1.00    -0.3832)
                     ( 1.00    -0.1987)  ( 0.00     0.0040)
 ***** SPIN 2 *****
 orbitals (Q,E):
 ---------------
 A :1...5            ( 1.00    -9.7907)  ( 1.00    -0.5907)  ( 1.00    -0.3683)  ( 1.00    -0.3683)
                     ( 0.00    -0.1324)
  
 Spin polar: 1 (Spin_A minus Spin_B electrons)

 SCF CONVERGED

 CYCLE    9
1
 ***************************************************************************************************



                                                *******************
                                                *  R E S U L T S  *
                                                *******************
  
 *** Using FIT density in Focky
  SDIIS (wt  1.000): -0.0000  0.0000  0.0000 -0.0000 -0.0016  0.0109  0.1714  0.8192
  DIIS coefficients: -0.0000  0.0000  0.0000 -0.0000 -0.0016  0.0109  0.1714  0.8192
 SCF Error: norm([F,P])=      0.000000551353, max([F,P])=      0.000000119513


                                   ***** SPIN 1 *****

 Scaled ZORA Orbital Energies, per Irrep and Spin:
 =================================================
                        Occup              E (au)              E (eV)       Diff (eV) with prev. cycle
                        -----      --------------------        ------       --------------------------
 A
               1        1.000     -0.98054410354921E+01      -266.820              -1.67E-07
               2        1.000     -0.62137909158749E+00       -16.909              -7.09E-07
               3        1.000     -0.38323434850183E+00       -10.428              -2.55E-06
               4        1.000     -0.38319547355853E+00       -10.427               1.23E-06
               5        1.000     -0.19868855116791E+00        -5.407              -5.25E-07
               6        0.000      0.40309425010975E-02         0.110
               7        0.000      0.62781782002162E-01         1.708
               8        0.000      0.62790089362578E-01         1.709
               9        0.000      0.14750552423083E+00         4.014
              10        0.000      0.14752090279425E+00         4.014
              11        0.000      0.16506655826296E+00         4.492
              12        0.000      0.22150379912680E+00         6.027
              13        0.000      0.38223557281122E+00        10.401
              14        0.000      0.38224064411107E+00        10.401
              15        0.000      0.47280185275439E+00        12.866
  
 HOMO :        5 A                -0.19868855116791E+00
 LUMO :        6 A                 0.40309425010975E-02
  


                                   ***** SPIN 2 *****

 Scaled ZORA Orbital Energies, per Irrep and Spin:
 =================================================
                        Occup              E (au)              E (eV)       Diff (eV) with prev. cycle
                        -----      --------------------        ------       --------------------------
 A
               1        1.000     -0.97906703863214E+01      -266.418              -3.38E-07
               2        1.000     -0.59074264601037E+00       -16.075              -4.52E-07
               3        1.000     -0.36828952798760E+00       -10.022              -2.40E-06
               4        1.000     -0.36826413953894E+00       -10.021               1.67E-06
               5        0.000     -0.13235261369116E+00        -3.601
               6        0.000      0.12577215640341E-01         0.342
               7        0.000      0.67496489811136E-01         1.837
               8        0.000      0.67500838119528E-01         1.837
               9        0.000      0.15408936304225E+00         4.193
              10        0.000      0.15411551603303E+00         4.194
              11        0.000      0.20217765971713E+00         5.502
              12        0.000      0.24060968514394E+00         6.547
              13        0.000      0.39443506885543E+00        10.733
              14        0.000      0.39443922690744E+00        10.733
  
 HOMO :        4 A                -0.36826413953894E+00
 LUMO :        5 A                -0.13235261369116E+00
  


 Orbital Energies, both Spins
 ========================================

 Irrep        no.  (spin)   Occup              E (au)                E (eV)
 ---------------------------------------------------------------------------
 A             1     A       1.00       -0.98054410354921E+01      -266.8196
 A             1      B      1.00       -0.97906703863214E+01      -266.4177
 A             2     A       1.00       -0.62137909158749E+00       -16.9086
 A             2      B      1.00       -0.59074264601037E+00       -16.0749
 A             3     A       1.00       -0.38323434850183E+00       -10.4283
 A             4     A       1.00       -0.38319547355853E+00       -10.4273
 A             3      B      1.00       -0.36828952798760E+00       -10.0217
 A             4      B      1.00       -0.36826413953894E+00       -10.0210
 A             5     A       1.00       -0.19868855116791E+00        -5.4066
 A             5      B      0.00       -0.13235261369116E+00        -3.6015
 A             6     A       0.00        0.40309425010975E-02         0.1097
 A             6      B      0.00        0.12577215640341E-01         0.3422
 A             7     A       0.00        0.62781782002162E-01         1.7084
 A             8     A       0.00        0.62790089362578E-01         1.7086
 A             7      B      0.00        0.67496489811136E-01         1.8367
 A             8      B      0.00        0.67500838119528E-01         1.8368
 A             9     A       0.00        0.14750552423083E+00         4.0138
 A            10     A       0.00        0.14752090279425E+00         4.0142
 A             9      B      0.00        0.15408936304225E+00         4.1930
 A            10      B      0.00        0.15411551603303E+00         4.1937
 A            11     A       0.00        0.16506655826296E+00         4.4917
 A            11      B      0.00        0.20217765971713E+00         5.5015
 A            12     A       0.00        0.22150379912680E+00         6.0274
 A            12      B      0.00        0.24060968514394E+00         6.5473
 A            13     A       0.00        0.38223557281122E+00        10.4012
 A            14     A       0.00        0.38224064411107E+00        10.4013
 A            13      B      0.00        0.39443506885543E+00        10.7331
 A            14      B      0.00        0.39443922690744E+00        10.7332
 A            15     A       0.00        0.47280185275439E+00        12.8656
 A            16     A       0.00        0.47281269047569E+00        12.8659
 A            15      B      0.00        0.48935719582963E+00        13.3161
 A            16      B      0.00        0.48937975902893E+00        13.3167
 A            17     A       0.00        0.66032470446950E+00        17.9683
 A            17      B      0.00        0.69449975978887E+00        18.8983
 A            18     A       0.00        0.77296469555035E+00        21.0334
 A            18      B      0.00        0.77426046036557E+00        21.0687
 A            19     A       0.00        0.84727824394631E+00        23.0556
 A            20     A       0.00        0.84728640268056E+00        23.0558
 A            19      B      0.00        0.85245894013034E+00        23.1966
 A            20      B      0.00        0.85247646732111E+00        23.1971
 A            21     A       0.00        0.90893615908973E+00        24.7334
 A            21      B      0.00        0.92766712178248E+00        25.2431
 A            22     A       0.00        0.11679093265924E+01        31.7804
 A            22      B      0.00        0.12057843679420E+01        32.8111
 A            23     A       0.00        0.14056892172810E+01        38.2507
 A            24     A       0.00        0.14057167032633E+01        38.2515
 A            23      B      0.00        0.14132875516040E+01        38.4575
 A            24      B      0.00        0.14133042601719E+01        38.4580
 A            25     A       0.00        0.17353922388473E+01        47.2224
 A            26     A       0.00        0.17353934344383E+01        47.2225
 A            25      B      0.00        0.17898738808002E+01        48.7049
 A            26      B      0.00        0.17898872504729E+01        48.7053
 A            27     A       0.00        0.18937395362025E+01        51.5313
 A            27      B      0.00        0.19106013615326E+01        51.9901
 A            28     A       0.00        0.20453410753339E+01        55.6566
 A            29     A       0.00        0.20453700002524E+01        55.6573
 A            28      B      0.00        0.20621130589225E+01        56.1130
 A            29      B      0.00        0.20621412368421E+01        56.1137
 A            30     A       0.00        0.22332486725102E+01        60.7698
 A            30      B      0.00        0.23017376243664E+01        62.6335
 A            31     A       0.00        0.25756285530433E+01        70.0864
 A            32     A       0.00        0.25758395953413E+01        70.0922
 A            31      B      0.00        0.25853026162059E+01        70.3497
 A            32      B      0.00        0.25855003832404E+01        70.3550
 A            33     A       0.00        0.30613656391852E+01        83.3040
 A            33      B      0.00        0.30997369932608E+01        84.3481
 A            34     A       0.00        0.42901289760062E+01       116.7403
 A            35     A       0.00        0.42902188616068E+01       116.7428
 A            34      B      0.00        0.43169287839519E+01       117.4696
 A            35      B      0.00        0.43170198249818E+01       117.4721
 A            36     A       0.00        0.64144297694290E+01       174.5455
 A            36      B      0.00        0.64563072563552E+01       175.6851
 A            37     A       0.00        0.53090657174978E+02      1444.6703
 A            37      B      0.00        0.53107772280434E+02      1445.1360
  
 Spin polar: 1 (Spin_A minus Spin_B electrons)


 All Electron Calculation, thus no Orbital Energies of the Core Orbitals are calculated


 Fit test: (difference of exact and fit density, squared integrated, result summed over spins)
         Sum-of-Fragments:                             0.00000000007794
         Orthogonalized Fragments:                     0.00001827992871
         SCF:                                          0.00004707743268



 ==========================
 Electron Density at Nuclei
 ==========================
  
 The electron density is calculated at points on a small sphere around the center of a nucleus.
 The printed electron density is the average electron density on these points.
 The radius of the sphere is the printed approximate finite nuclear radius.
 Note: ZORA-4 density is used, which includes small component density

         Atom        Nuclear Radius (Angstrom)             Electron Density (a.u.)
         ----        -------------------------             -----------------------
     1)   C                 0.0000320678                              124.46526
     2)   H                 0.0000181514                                0.48011
     3)   H                 0.0000181514                                0.48011
     4)   H                 0.0000181514                                0.47994



 =======================================
 M U L L I K E N   P O P U L A T I O N S
 =======================================
  
 The survey below gives for each atom:
 a) the total charge (Z minus electrons)
 b) the net spin polarization (nr of electrons spin-A minus spin-B)
 c) for each spin the atomic electron valence density (integrated) per L-value.

 Atom              Charge    Spin density          S         P         D         F
 ----              ------    ------------       ------    ------    ------    ------
 1 C               0.2476          1.0782   A:  1.5322    1.8749    0.0082    0.0000
                                            B:  1.4698    0.8571    0.0103    0.0000
 2 H              -0.0825         -0.0260   A:  0.4762    0.0521    0.0000    0.0000
                                            B:  0.5248    0.0295    0.0000    0.0000
 3 H              -0.0825         -0.0260   A:  0.4762    0.0521    0.0000    0.0000
                                            B:  0.5248    0.0295    0.0000    0.0000
 4 H              -0.0825         -0.0261   A:  0.4762    0.0521    0.0000    0.0000
                                            B:  0.5248    0.0295    0.0000    0.0000

 Populations of individual BAS functions
 ----------------------------------------
 1 C            0.2433  0.7471  0.0840  0.4756 -0.0178 -0.0672 -0.0672  0.2579  0.4371  0.4371
                0.5306  0.1043  0.1042  0.1382  0.0030  0.0040  0.0000  0.0030  0.0000 -0.0017
         B:     0.2411  0.7521  0.0440  0.4515 -0.0190 -0.0836 -0.0835 -0.0000  0.4110  0.4110
                0.0000  0.1011  0.1011  0.0000  0.0089  0.0039  0.0000  0.0089  0.0000 -0.0115
 2 H            0.0307  0.2855  0.1601  0.0124  0.0152  0.0244
         B:     0.0357  0.3315  0.1577  0.0138  0.0156  0.0000
 3 H            0.0307  0.2855  0.1601  0.0124  0.0152  0.0244
         B:     0.0357  0.3315  0.1577  0.0138  0.0156  0.0000
 4 H            0.0304  0.2858  0.1599  0.0165  0.0111  0.0244
         B:     0.0355  0.3317  0.1575  0.0165  0.0129  0.0000

 Gross Charges per Atom (Z minus electrons)
 ==========================================
             0.2476   -0.0825   -0.0825   -0.0825
 Net Total: -0.00000000


 Atom-Atom Population Matrix (off-diagonal elements not doubled)
 ===============================================================


                                   ***** SPIN 1 *****

     1 :     2.7446
     2 :     0.2236    0.3640
     3 :     0.2236   -0.0297    0.3640
     4 :     0.2236   -0.0297   -0.0297    0.3640

                                   ***** SPIN 2 *****

     1 :     1.7488
     2 :     0.1961    0.4278
     3 :     0.1961   -0.0348    0.4278
     4 :     0.1961   -0.0348   -0.0348    0.4279



 =================================================
 H I R S H F E L D   C H A R G E   A N A L Y S I S
 =================================================
  
 For each fragment: the (numerical) integral of rho(scf) * rho(fragment)/rho(sum-of-fragments)
 (nuclear charges are included, electrons are counted negative)

 The fragments and their ordering are defined in the early G E O M E T R Y output section.
 If you use single-atom fragments, this usually implies that all atoms of the same
 chemical type are grouped together. This may not be the order in which you listed them
 in the input file!

    1  C                        -0.1328
    2  H                         0.0443
    3  H                         0.0443
    4  H                         0.0443

 Sum of these charges (accuracy NumInt/Tails) =           0.00002446



 =============================
 V O R O N O I   C H A R G E S
 =============================
  
 For each atom: the (numerical) integral of the total electronic charge density in its Voronoi cell,
 i.e. the region of space that is closer to that atom than to any other atom.
 (cf. Wigner-Seitz cells in crystals)

 Within the Voronoi cell the subintegrals over the atomic sphere and the remaining part are evaluated
 separately to give the numbers of electrons (negative charge) in these regions.
 The net total charge in the cell (including the nuclear charge) is also given.

 Values are provided for
    a) the Initial (sum-of-fragments) density
    b) the Orthogonalized-Fragments density
    c) the SCF density
    d) the Voronoi Deformation Density (VDD): the difference SCF-Initial for the complete atomic cell


  Atom                Initial                    OrthFrag                   SCF
             Sphere RestCell NetTotal   Sphere RestCell NetTotal   Sphere RestCell NetTotal      VDD
 -----       ------------------------   ------------------------   ------------------------    -----
    1 C      -2.084   -2.419    1.498   -2.165   -2.710    1.125   -2.106   -2.459    1.435   -0.062
    2 H      -0.072   -1.439   -0.511   -0.090   -1.292   -0.382   -0.105   -1.381   -0.486    0.025
    3 H      -0.072   -1.420   -0.491   -0.090   -1.280   -0.370   -0.105   -1.368   -0.473    0.018
    4 H      -0.072   -1.424   -0.496   -0.090   -1.283   -0.373   -0.106   -1.370   -0.476    0.020
 ---------------------------------------------------------------------------------------------------
 Total NetCharge:               0.000                      0.000                      0.000    0.000
 (accuracy NumInt/Tails)

 Remark: the 'NetTotal' Voronoi charges often do not match the Mulliken and/or Hirshfeld charges very
 well. This is caused by the fact that chemically different atoms are not treated in accordance with
 their relative sizes. (Voronoi cells are defined by boundary planes halfway between the atoms.)
 However, the CHANGES in charge, comparing 'Initial' to 'SCF' for instance, do give a fair indication
 of the flow of charge caused by the relaxation from sum-of-fragments to self-consistency.

 Warning: the absolute accuracy of the VDD charges obtained using the Fuzzy Cells (Becke) integration
 scheme is much poorer than the one obtained with an 'equivalent' Voronoi integration grid. 



 =================================================================
 M U L T I P O L E   D E R I V E D   C H A R G E   A N A L Y S I S
 =================================================================

 This charge analysis uses the atomic multipoles (obtained from the fitted density) up to some level X,
 and reconstructs these multipoles exactly (up to level X) by distributing charges over all atoms.
 This is achieved by using Lagrange multipliers and a weight function to keep the multipoles local.

 Dummy atoms can be included (by setting INCDUM in MDC-block to 1) to obtain a fractional charge.
 This is generally useful and necessary only for small symmetrical molecules, when there are not
 enough degrees of freedom to reconstruct the multipoles.

 Since the atomic multipoles are reconstructed up to level X,
 the molecular multipoles are represented also up to level X.
 The recommended level is to reconstruct up to quadrupole : -> MDC-q charges.

 See: M. Swart, P.Th. van Duijnen, J.G. Snijders, J.Comput.Chem., (2001), p. 79-88.

 ------------------------------------------------------------------------ 
 Atomic electronic multipole moments from SCF equations (a.u.) for spin A
 ------------------------------------------------------------------------ 

   atom        charge        dip-x     dip-y     dip-z      quad-xx   quad-xy   quad-xz   quad-yy   quad-yz   quad-zz
 --------------------------------------------------------------------------------------------------------------------
    1 C     -0.345012     0.000065 -0.000000 -0.000000     0.629460 -0.000000 -0.000000  0.629668 -0.000000 -1.259129
    2 H     -0.051669     0.013129  0.022676 -0.000000     0.055938  0.053433  0.000000  0.148704 -0.000000 -0.204642
    3 H     -0.051669     0.013129 -0.022676  0.000000     0.055938 -0.053433 -0.000000  0.148704 -0.000000 -0.204642
    4 H     -0.051651    -0.026221  0.000000 -0.000000     0.194878 -0.000000 -0.000000  0.009666 -0.000000 -0.204544

 ------------------------------------------------------------------------ 
 Atomic electronic multipole moments from SCF equations (a.u.) for spin B
 ------------------------------------------------------------------------ 

   atom        charge        dip-x     dip-y     dip-z      quad-xx   quad-xy   quad-xz   quad-yy   quad-yz   quad-zz
 --------------------------------------------------------------------------------------------------------------------
    1 C      0.509284     0.000095  0.000000  0.000000    -0.117914 -0.000000 -0.000000 -0.117704 -0.000000  0.235618
    2 H     -0.003095    -0.002894 -0.005082 -0.000000    -0.030318  0.047363  0.000000  0.052091  0.000000 -0.021773
    3 H     -0.003095    -0.002894  0.005082  0.000000    -0.030318 -0.047363  0.000000  0.052091  0.000000 -0.021773
    4 H     -0.003094     0.005755 -0.000000 -0.000000     0.092627 -0.000000 -0.000000 -0.071043 -0.000000 -0.021584

 ----------------------------------------------------- 
 MDC atomic charges (includes spinA + spinB electrons)
 ----------------------------------------------------- 

 The MDC-m charges are just the Monopole terms in the multipole expansion, while for the MDC-d charges
 also the Dipoles are reconstructed. The usually preferred charges are the MDC-q charges.
 These reconstruct the Monopoles, Dipoles and Quadrupoles (both atomic AND molecular).

 Given here are the atomic charges of both spins added. These should be compared
 to the values from a "normal" RESTRICTED calculation.

        Atom    Level:     MDC-m        MDC-d        MDC-q
 ---------------------------------------------------------
     1     C            0.164272     0.122057    -0.479698
     2     H           -0.054763    -0.040665     0.169717
     3     H           -0.054763    -0.040665     0.169717
     4     H           -0.054745    -0.040727     0.140264

 -------------------------------- 
 MDC spin density (spinA - spinB)
 -------------------------------- 
 Reported here are the the number of Alpha-electrons minus the number of Beta-electrons
 per atom, which usually are regarded as spin densities.

        Atom    Level:     MDC-m        MDC-d        MDC-q
 ---------------------------------------------------------
     1     C            0.854295     0.775431     1.849945
     2     H            0.048574     0.074855    -0.283507
     3     H            0.048574     0.074855    -0.283507
     4     H            0.048557     0.074858    -0.282930

 --------------------------------------------- 
 Represented total molecular multipole moments
 --------------------------------------------- 

 Given here are the Molecular multipole moments from the atomic charges, and from the Fit Density.
 Note that the atomic charges represent the latter, NOT the ones from the Exact density.

 Reported here are the Molecular multipole moments of both spins added.
 They should be compared to the values from a "normal" RESTRICTED calculation.

            Q (a.u.)             Dipole moment (Debye)                                          Quadrupole moment (a.u.)
                                 x         y         z              xx        xy        xz        yy        yz        zz
------------------------------------------------------------------------------------------------------------------------
MDC-m         0.0000       -0.0001   -0.0000    0.0000         -0.1688   -0.0000    0.0000   -0.1689    0.0000    0.3376
MDC-d         0.0000        0.0003   -0.0000    0.0000         -0.1256   -0.0000    0.0000   -0.1252    0.0000    0.2509
MDC-q         0.0000        0.1518   -0.0000    0.0000          0.4022   -0.0000    0.0000    0.5838    0.0000   -0.9859
 
Fit.Dens.     0.0000        0.0003   -0.0000   -0.0000          0.7442   -0.0000    0.0000    0.7446   -0.0000   -1.4889



 ==========
 S**2 value  ***  see also R. Bulo et al., J.Am.Chem.Soc., 124 (2002) 13903-13910, note (29)  ***
 ==========
  
                                       exact      expectation value

 Total S2 (S squared)                  0.75000             0.75222



 =============
 Dipole Moment  ***  (Debye)  ***
 =============
  
 Vector   :        -0.00032299     -0.00000001      0.00000003
 Magnitude:         0.00032299

 This molecular dipole moment is calculated with analytic integration



 =========================================
 Quadrupole Moment (Buckingham convention)  ***  (a.u.)  ***
 =========================================
  
      quad-xx        quad-xy        quad-xz        quad-yy        quad-yz        quad-zz
      0.74585150    -0.00000001    -0.00000000     0.74595622    -0.00000002    -1.49180772

 This molecular quadrupole moment is calculated with analytic integration
1



 ===========================
 B O N D I N G   E N E R G Y  ***  (decomposition)  ***
 ===========================
  
*** IMPORTANT NOTE ***

The bond energy is computed as an energy difference between molecule and
fragments. In particular when the fragments are single atoms, they are usually
computed as SPHERICALLY SYMMETRIC and SPIN-RESTRICTED. Obviously, this usually
does NOT represent the true atomic groundstate.

To obtain the 'real' bond energy, (atomic) correction terms must be applied
for the true (multiplet) fragment ground state. See ref: E.J.Baerends,
V.Branchadell, M.Sodupe, Chem.Phys.Lett.265 (1997) 481

General theoretical background on the bond energy decomposition scheme used
here (Morokuma-Ziegler) can be found in the review paper:
F.M. Bickelhaupt and E.J. Baerends,
"Kohn-Sham Density Functional Theory: Predicting and Understanding Chemistry"
In: Rev. Comput. Chem.; Lipkowitz, K. B. and Boyd, D. B., Eds.;
Wiley-VCH: New York, 2000, Vol. 15, 1-86.

Symbols used in the Bickelhaupt-Baerends (BB) paper are given below to make
the direct connection to that paper, where detailed explanations can be found
on the meaning of the various terms.


                                                   hartree              eV         kcal/mol           kJ/mol
                                      --------------------     -----------       ----------      -----------

Pauli Repulsion
  Kinetic (Delta T^0):                   4.120040099006182        112.1120          2585.36         10817.16
  Delta V^Pauli Coulomb:                -1.717139906533014        -46.7258         -1077.52         -4508.35
  Delta V^Pauli LDA-XC:                 -0.551079804251719        -14.9956          -345.81         -1446.86
                                      --------------------     -----------       ----------      -----------
  Total Pauli Repulsion:                 1.851820388221450         50.3906          1162.03          4861.95
 (Total Pauli Repulsion =
  Delta E^Pauli in BB paper)

Steric Interaction
  Pauli Repulsion (Delta E^Pauli):       1.851820388221450         50.3906          1162.03          4861.95
  Electrostatic Interaction:            -0.255066411282253         -6.9407          -160.06          -669.68
 (Electrostatic Interaction =
  Delta V_elstat in the BB paper)
                                      --------------------     -----------       ----------      -----------
  Total Steric Interaction:              1.596753976939196         43.4499          1001.98          4192.28
 (Total Steric Interaction =
  Delta E^0 in the BB paper)

Orbital Interactions
  A:                                    -2.277583631259680        -61.9762         -1429.21         -5979.79
                                      --------------------     -----------       ----------      -----------
  Total Orbital Interactions:           -2.277583631259680        -61.9762         -1429.21         -5979.79

Alternative Decomposition Orb.Int.
  Kinetic:                              -3.399034731797727        -92.4924         -2132.93         -8924.16
  Coulomb:                               1.193865446291705         32.4867           749.16          3134.49
  XC:                                   -0.072414345753657         -1.9705           -45.44          -190.12
                                      --------------------     -----------       ----------      -----------
  Total Orbital Interactions:           -2.277583631259680        -61.9762         -1429.21         -5979.79

  Residu (E=Steric+OrbInt+Res):         -0.000011299011640         -0.0003            -0.01            -0.03

Total Bonding Energy:                   -0.680840953332124        -18.5266          -427.23         -1787.55


Summary of Bonding Energy (energy terms are taken from the energy decomposition above)
======================================================================================

  Electrostatic Energy:                 -0.255066411282253         -6.9407          -160.06          -669.68
  Kinetic Energy:                        0.721005367208455         19.6196           452.44          1893.00
  Coulomb (Steric+OrbInt) Energy:       -0.523285759252949        -14.2393          -328.37         -1373.89
  XC Energy:                            -0.623494150005376        -16.9661          -391.25         -1636.98
                                      --------------------     -----------       ----------      -----------
  Total Bonding Energy:                 -0.680840953332123        -18.5266          -427.23         -1787.55


Correction terms (incorporated in energies above; only for test purposes):

1. Indication of fit-quality: 1st-order fit-correction used in the energy (hartree):   0.0001652990
2. Electrostatic (Fit correction):   0.0000000000

Scaled ZORA energy correction, not included in bonding energy (hartree):            0.0000005975
 NOTE: This scaled ZORA energy correction should only be used to compare two calculations
 in which the only difference in the calculation is the electron configuration.
 Then the difference in energy of this term should be added to the difference in energy of
 the two electron configurations.
 This term should not be used otherwise.
 In practice it is useful only for core excitation energy calculations.



 =========================================
 F R A G M E N T   E N E R G Y   T E R M S  ***  (summed over all fragments)  ***
 =========================================
  

The energy terms below are (parts of) the Total Energy of the fragments from which the molecule
 is built.

Exchange and Correlation
  Exchange LDA:                         -4.937152960608452       -134.3468         -3098.11        -12962.49
  Exchange GGA:                          0.000000000000000          0.0000             0.00             0.00
  Correlation LDA:                      -0.490983488823286        -13.3603          -308.10         -1289.08
  Correlation GGA:                       0.000000000000000          0.0000             0.00             0.00
                                      --------------------     -----------       ----------      -----------
  Total XC:                             -5.428136449431737       -147.7071         -3406.21        -14251.57
1



 =======================================================
 S F O   P O P U L A T I O N S ,   M O   A N A L Y S I S
 =======================================================
  
 A Mulliken population analysis is performed on (input-)selected MOs. All populations refer to SFOs.
 BAS populations may have been printed directly after the SCF part.



                                   ***** SPIN 1 *****



                                       === A ===


 SFO contributions (%) per orbital
 (multiplication by the orbital occupation yields the SFO Gross Populations)

 Orb.:        1      2      3      4      5      6      7      8      9
 occup:     1.00   1.00   1.00   1.00   1.00   0.00   0.00   0.00   0.00
 CF+SFO     ----   ----   ----   ----   ----   ----   ----   ----   ----
 ------
      1:   99.95   0.01  -0.00   0.00  -0.00  -0.01   0.00  -0.00  -0.00
      2:   -0.00  53.86  -0.00   0.00   0.00   4.04   0.00   0.00   0.00
      3:    0.00  -0.59   0.00  -0.00   0.00 -17.10  -0.00  -0.00  -0.00
      6:   -0.00   0.00   0.00  48.01   0.00  -0.00   0.00   3.51   0.00
      7:    0.00   0.00  -0.00  -0.22   0.00  -0.00  -0.00 -41.32   0.00
      9:   -0.00   0.00  48.01   0.00   0.00   0.00   3.50   0.00  44.78
     10:    0.00  -0.00  -0.22  -0.00  -0.00  -0.00 -41.30  -0.00  61.62
     11:    0.00  -0.00  -0.38  -0.00  -0.00  -0.00   0.99   0.00  -1.46
     12:   -0.00   0.00   0.00   0.00  92.63   0.00   0.00   0.00  -0.00
     20:    0.01  14.61  24.31   8.10  -0.00  14.71  36.55  12.16  16.25
     21:   -0.00  -0.63   1.02   0.34   0.00  23.04  28.58   9.50 -16.22
     22:   -0.00  -0.28   0.11   0.04  -0.00  -0.92   2.77   0.92  -5.16
     24:    0.01   1.40  -0.34   0.45   0.00   0.60   0.30   0.16   0.18
     25:    0.00   0.00   0.00   0.00   2.44   0.00  -0.00  -0.00  -0.00
     26:    0.01  14.61  24.31   8.10  -0.00  14.71  36.51  12.20  16.25
     27:   -0.00  -0.63   1.02   0.34   0.00  23.04  28.55   9.53 -16.22
     28:   -0.00  -0.28   0.11   0.04  -0.00  -0.92   2.76   0.92  -5.16
     30:    0.01   1.40  -0.34   0.45   0.00   0.60   0.30   0.16   0.18
     31:   -0.00   0.00   0.00   0.00   2.44  -0.00  -0.00  -0.00  -0.00
     32:    0.01  14.60   0.00  32.42  -0.00  14.70   0.00  48.72   0.00
     33:   -0.00  -0.63   0.00   1.36  -0.00  23.03   0.00  38.10  -0.00
     34:   -0.00  -0.28   0.00   0.14   0.00  -0.92   0.00   3.69  -0.00
     35:    0.01   1.87  -0.00  -0.23  -0.00   0.80   0.00   0.62  -0.00
     36:   -0.00  -0.00   1.11   0.00  -0.00  -0.00   0.01   0.00   4.66
     37:    0.00   0.00   0.00   0.00   2.44  -0.00  -0.00   0.00  -0.00


 Summation over all MOs, multiplied by occupation: Total SFO Gross Populations in this Irrep
 ===========================================================================================

     1.00    0.54   -0.01   -0.00   -0.00    0.48   -0.00   -0.00    0.48   -0.00   -0.00    0.93
     0.00    0.00    0.00    0.00    0.00    0.00    0.00    0.47    0.01   -0.00    0.01    0.02
     0.02    0.47    0.01   -0.00    0.01    0.02    0.02    0.47    0.01   -0.00    0.02    0.01
     0.02



                                   ***** SPIN 2 *****



                                       === A ===


 SFO contributions (%) per orbital
 (multiplication by the orbital occupation yields the SFO Gross Populations)

 Orb.:        1      2      3      4      5      6      7      8
 occup:     1.00   1.00   1.00   1.00   0.00   0.00   0.00   0.00
 CF+SFO     ----   ----   ----   ----   ----   ----   ----   ----
 ------
      1:  100.07   0.00  -0.00   0.00  -0.00  -0.01   0.00  -0.00
      2:    0.00  47.71  -0.00   0.00   0.00   5.23  -0.00   0.00
      3:   -0.00  -0.80   0.00  -0.00   0.00 -18.19   0.00  -0.00
      6:   -0.00   0.00   0.00  43.76   0.00   0.00   0.00   4.37
      7:    0.00   0.00  -0.00  -0.47  -0.00  -0.00  -0.00 -43.17
      8:    0.00  -0.00  -0.00  -0.45   0.00   0.00   0.00   1.05
      9:   -0.00   0.00  43.77   0.00   0.00   0.00   4.37   0.00
     10:    0.00   0.00  -0.47  -0.00  -0.00  -0.00 -43.16  -0.00
     11:    0.00  -0.00  -0.45  -0.00  -0.00  -0.00   1.05   0.00
     12:   -0.00   0.00   0.00   0.00  89.15  -0.00   0.00   0.00
     20:   -0.01  16.57  26.64   8.88  -0.00  13.88  34.87  11.58
     21:   -0.00  -0.66   0.88   0.29   0.00  23.86  30.60  10.15
     22:   -0.00  -0.24   0.10   0.03  -0.00  -0.95   2.85   0.95
     24:   -0.00   1.46  -0.37   0.47   0.00   0.61   0.38   0.17
     25:    0.00   0.00   0.00   0.00   3.31   0.00  -0.00   0.00
     26:   -0.01  16.57  26.64   8.88   0.00  13.88  34.80  11.65
     27:   -0.00  -0.66   0.88   0.29   0.00  23.86  30.54  10.22
     28:   -0.00  -0.24   0.10   0.03   0.00  -0.95   2.84   0.95
     30:   -0.00   1.46  -0.37   0.47   0.00   0.61   0.38   0.17
     31:   -0.00   0.00   0.00   0.00   3.31  -0.00  -0.00   0.00
     32:   -0.01  16.56   0.00  35.54  -0.00  13.86   0.00  46.47
     33:   -0.00  -0.66   0.00   1.17  -0.00  23.85   0.00  40.77
     34:   -0.00  -0.24   0.00   0.14  -0.00  -0.95   0.00   3.80
     35:   -0.01   1.95  -0.00  -0.29   0.00   0.81   0.00   0.74
     36:   -0.00  -0.00   1.29   0.00  -0.00  -0.00   0.01   0.00
     37:    0.00   0.00   0.00   0.00   3.31  -0.00  -0.00   0.00


 Summation over all MOs, multiplied by occupation: Total SFO Gross Populations in this Irrep
 ===========================================================================================

     1.00    0.48   -0.01   -0.00   -0.00    0.44   -0.00   -0.00    0.44   -0.00   -0.00    0.00
     0.00    0.00    0.00    0.00    0.00    0.00    0.00    0.52    0.01   -0.00    0.01    0.02
     0.00    0.52    0.01   -0.00    0.01    0.02    0.00    0.52    0.01   -0.00    0.02    0.01
     0.00



 List of all MOs, ordered by energy, with the most significant SFO gross populations
 ===================================================================================

 Each percentage contribution in the table below corres ponds to the indicated SFO.
 In general, a SFO may be a linear combination of several Fragment Orbitals on the same,
 or on symmetry-related Fragments. Only the first 'member' of such a combination is
 specified here. A full definition of all SFOs is given in an earlier part of the output.
 The numbering of the SFOs in this table does NOT include the Core Orbitals, and starts
 from one for each symmetry representation, as in the SFO definition list earlier.


                                       *** SPIN 1 ***


       E(eV)  Occ       MO           %     SFO (first member)   E(eV)  Occ   Fragment
 -------------------------------------------------------------------------------------

     -16.909  1.00     2 A         53.86%     2 S             -13.671  2.00     1 C
                                   14.61%     1 S              -6.353  1.00     3 H
                                   14.61%     1 S              -6.353  1.00     2 H
                                   14.60%     1 S              -6.353  1.00     4 H
                                    1.87%     1 P:x            10.966  0.00     4 H
                                    1.40%     1 P:y            10.966  0.00     3 H
                                    1.40%     1 P:y            10.966  0.00     2 H
     -10.428  1.00     3 A         48.01%     1 P:y            -5.438  0.67     1 C
                                   24.31%     1 S              -6.353  1.00     3 H
                                   24.31%     1 S              -6.353  1.00     2 H
                                    1.11%     1 P:y            10.966  0.00     4 H
                                    1.02%     2 S               2.572  0.00     3 H
                                    1.02%     2 S               2.572  0.00     2 H
     -10.427  1.00     4 A         48.01%     1 P:x            -5.438  0.67     1 C
                                   32.42%     1 S              -6.353  1.00     4 H
                                    8.10%     1 S              -6.353  1.00     2 H
                                    8.10%     1 S              -6.353  1.00     3 H
                                    1.36%     2 S               2.572  0.00     4 H
      -5.407  1.00     5 A         92.63%     1 P:z            -5.438  0.67     1 C
                                    2.44%     1 P:z            10.966  0.00     3 H
                                    2.44%     1 P:z            10.966  0.00     2 H
                                    2.44%     1 P:z            10.966  0.00     4 H
       0.110  0.00     6 A         23.04%     2 S               2.572  0.00     3 H
                                   23.04%     2 S               2.572  0.00     2 H
                                   23.03%     2 S               2.572  0.00     4 H
                                  -17.10%     3 S              10.122  0.00     1 C
                                   14.71%     1 S              -6.353  1.00     3 H
                                   14.71%     1 S              -6.353  1.00     2 H
                                   14.70%     1 S              -6.353  1.00     4 H
                                    4.04%     2 S             -13.671  2.00     1 C
       1.708  0.00     7 A        -41.30%     2 P:y             4.585  0.00     1 C
                                   36.55%     1 S              -6.353  1.00     2 H
                                   36.51%     1 S              -6.353  1.00     3 H
                                   28.58%     2 S               2.572  0.00     2 H
                                   28.55%     2 S               2.572  0.00     3 H
                                    3.50%     1 P:y            -5.438  0.67     1 C
                                    2.77%     3 S              42.104  0.00     2 H
                                    2.76%     3 S              42.104  0.00     3 H
       1.709  0.00     8 A         48.72%     1 S              -6.353  1.00     4 H
                                  -41.32%     2 P:x             4.585  0.00     1 C
                                   38.10%     2 S               2.572  0.00     4 H
                                   12.20%     1 S              -6.353  1.00     3 H
                                   12.16%     1 S              -6.353  1.00     2 H
                                    9.53%     2 S               2.572  0.00     3 H
                                    9.50%     2 S               2.572  0.00     2 H
                                    3.69%     3 S              42.104  0.00     4 H
                                    3.51%     1 P:x            -5.438  0.67     1 C
       4.014  0.00     9 A         61.62%     2 P:y             4.585  0.00     1 C
                                   44.78%     1 P:y            -5.438  0.67     1 C
                                   16.25%     1 S              -6.353  1.00     3 H
                                   16.25%     1 S              -6.353  1.00     2 H
                                  -16.22%     2 S               2.572  0.00     3 H
                                  -16.22%     2 S               2.572  0.00     2 H
                                   -5.16%     3 S              42.104  0.00     3 H
                                   -5.16%     3 S              42.104  0.00     2 H
                                    4.66%     1 P:y            10.966  0.00     4 H
                                   -1.46%     3 P:y            54.615  0.00     1 C
       4.014  0.00    10 A         61.64%     2 P:x             4.585  0.00     1 C
                                   44.77%     1 P:x            -5.438  0.67     1 C
                                   21.66%     1 S              -6.353  1.00     4 H
                                  -21.62%     2 S               2.572  0.00     4 H
                                   -6.88%     3 S              42.104  0.00     4 H
                                    5.42%     1 S              -6.353  1.00     2 H
                                    5.42%     1 S              -6.353  1.00     3 H
                                   -5.41%     2 S               2.572  0.00     2 H
                                   -5.41%     2 S               2.572  0.00     3 H
                                    3.20%     1 P:x            10.966  0.00     3 H
                                    3.20%     1 P:x            10.966  0.00     2 H
                                   -1.72%     3 S              42.104  0.00     2 H
                                   -1.72%     3 S              42.104  0.00     3 H
                                   -1.46%     3 P:x            54.615  0.00     1 C
                                   -1.39%     1 P:x            10.966  0.00     4 H
       4.492  0.00    11 A        105.85%     2 P:z             4.585  0.00     1 C
                                   -1.83%     1 P:z            10.966  0.00     4 H
                                   -1.83%     1 P:z            10.966  0.00     2 H
                                   -1.83%     1 P:z            10.966  0.00     3 H


                                       *** SPIN 2 ***


       E(eV)  Occ       MO           %     SFO (first member)   E(eV)  Occ   Fragment
 -------------------------------------------------------------------------------------

     -16.075  1.00     2 A         47.71%     2 S             -13.671  2.00     1 C
                                   16.57%     1 S              -6.353  1.00     3 H
                                   16.57%     1 S              -6.353  1.00     2 H
                                   16.56%     1 S              -6.353  1.00     4 H
                                    1.95%     1 P:x            10.966  0.00     4 H
                                    1.46%     1 P:y            10.966  0.00     3 H
                                    1.46%     1 P:y            10.966  0.00     2 H
     -10.022  1.00     3 A         43.77%     1 P:y            -5.438  0.67     1 C
                                   26.64%     1 S              -6.353  1.00     3 H
                                   26.64%     1 S              -6.353  1.00     2 H
                                    1.29%     1 P:y            10.966  0.00     4 H
     -10.021  1.00     4 A         43.76%     1 P:x            -5.438  0.67     1 C
                                   35.54%     1 S              -6.353  1.00     4 H
                                    8.88%     1 S              -6.353  1.00     2 H
                                    8.88%     1 S              -6.353  1.00     3 H
                                    1.17%     2 S               2.572  0.00     4 H
      -3.601  0.00     5 A         89.15%     1 P:z            -5.438  0.67     1 C
                                    3.31%     1 P:z            10.966  0.00     3 H
                                    3.31%     1 P:z            10.966  0.00     2 H
                                    3.31%     1 P:z            10.966  0.00     4 H
       0.342  0.00     6 A         23.86%     2 S               2.572  0.00     3 H
                                   23.86%     2 S               2.572  0.00     2 H
                                   23.85%     2 S               2.572  0.00     4 H
                                  -18.19%     3 S              10.122  0.00     1 C
                                   13.88%     1 S              -6.353  1.00     3 H
                                   13.88%     1 S              -6.353  1.00     2 H
                                   13.86%     1 S              -6.353  1.00     4 H
                                    5.23%     2 S             -13.671  2.00     1 C
       1.837  0.00     7 A        -43.16%     2 P:y             4.585  0.00     1 C
                                   34.87%     1 S              -6.353  1.00     2 H
                                   34.80%     1 S              -6.353  1.00     3 H
                                   30.60%     2 S               2.572  0.00     2 H
                                   30.54%     2 S               2.572  0.00     3 H
                                    4.37%     1 P:y            -5.438  0.67     1 C
                                    2.85%     3 S              42.104  0.00     2 H
                                    2.84%     3 S              42.104  0.00     3 H
                                    1.05%     3 P:y            54.615  0.00     1 C
       1.837  0.00     8 A         46.47%     1 S              -6.353  1.00     4 H
                                  -43.17%     2 P:x             4.585  0.00     1 C
                                   40.77%     2 S               2.572  0.00     4 H
                                   11.65%     1 S              -6.353  1.00     3 H
                                   11.58%     1 S              -6.353  1.00     2 H
                                   10.22%     2 S               2.572  0.00     3 H
                                   10.15%     2 S               2.572  0.00     2 H
                                    4.37%     1 P:x            -5.438  0.67     1 C
                                    3.80%     3 S              42.104  0.00     4 H
                                    1.05%     3 P:x            54.615  0.00     1 C
       4.193  0.00     9 A         60.37%     2 P:y             4.585  0.00     1 C
                                   46.05%     1 P:y            -5.438  0.67     1 C
                                  -15.87%     2 S               2.572  0.00     3 H
                                  -15.87%     2 S               2.572  0.00     2 H
                                   15.38%     1 S              -6.353  1.00     3 H
                                   15.38%     1 S              -6.353  1.00     2 H
                                    5.17%     1 P:y            10.966  0.00     4 H
                                   -5.08%     3 S              42.104  0.00     3 H
                                   -5.08%     3 S              42.104  0.00     2 H
                                   -1.41%     3 P:y            54.615  0.00     1 C
       4.194  0.00    10 A         60.38%     2 P:x             4.585  0.00     1 C
                                   46.04%     1 P:x            -5.438  0.67     1 C
                                  -21.16%     2 S               2.572  0.00     4 H
                                   20.50%     1 S              -6.353  1.00     4 H
                                   -6.77%     3 S              42.104  0.00     4 H
                                   -5.29%     2 S               2.572  0.00     2 H
                                   -5.29%     2 S               2.572  0.00     3 H
                                    5.12%     1 S              -6.353  1.00     2 H
                                    5.12%     1 S              -6.353  1.00     3 H
                                    3.40%     1 P:x            10.966  0.00     3 H
                                    3.40%     1 P:x            10.966  0.00     2 H
                                   -1.69%     3 S              42.104  0.00     2 H
                                   -1.69%     3 S              42.104  0.00     3 H
                                   -1.41%     3 P:x            54.615  0.00     1 C
                                   -1.30%     1 P:x            10.966  0.00     4 H
       5.502  0.00    11 A        105.70%     2 P:z             4.585  0.00     1 C
                                   -1.74%     1 P:z            10.966  0.00     4 H
                                   -1.74%     1 P:z            10.966  0.00     2 H
                                   -1.74%     1 P:z            10.966  0.00     3 H



 =======================================================================
 Electrostatic potential at the Nuclei due to electrons and other nuclei
 =======================================================================
  
         Atom                  Potential
         ----                  ---------
     1)   C                  14.70973789
     2)   H                   1.07685413
     3)   H                   1.07685412
     4)   H                   1.07709405
 Mulliken charges used for AMS results%charges...


    =====================
     CALCULATION RESULTS
    =====================

Energy (hartree)            -0.68084095


--------------
Atomic charges
--------------
  Index   Atom    Charge
      1      C    0.2476
      2      H   -0.0825
      3      H   -0.0825
      4      H   -0.0825


Dipole moment vector    (Debye):    -0.00032299   -0.00000001    0.00000003
              magnitude (Debye):     0.00032299


AMS application finished. Exiting.
NORMAL TERMINATION
     Total cpu time:       7.78
  Total system time:       4.17
 Total elapsed time:      16.28
